{"schema_version":"1.0.0","chart_id":"f03-techniques","clock_domain":"song_time","time_unit":"microseconds","duration_us":30000000,"notes":[{"note_id":"n1","timestamp_us":1000000,"technique":"tone","target_id":"tone-1"},{"note_id":"n2","timestamp_us":2000000,"technique":"ding","target_id":"ding"},{"note_id":"n3","timestamp_us":3000000,"technique":"slap","target_id":"outer-hit-radius"}]}
